id,permalink,userUrl,author_name,fullname,avatar,verified,text,html,isRetweet,retweetedBy,replyingTo,relativeTime,displayTime,createdAt,images,links,comments,retweets,likes,Views,bank_ext,post,posttype,Sentiment,uae_time,ddmmyyyy
2035756208804552943,https://x.com/EmiratesNBD_AE/status/2035756208804552943,https://x.com/EmiratesNBD_AE,EmiratesNBD_AE,Emirates NBD,https://pbs.twimg.com/profile_images/1762427651271110656/jOUBidn8_bigger.jpg,,"We are extremely sorry for the inconvenience caused to you, and we have replied you via direct message already.","We are extremely sorry for the inconvenience caused to you, and we have replied you via direct message already.",False,,['koko_isa8'],4h,"Mar 22, 2026 · 4:31 PM UTC",2026-03-22 16:31:00+00:00,,,0,0,0,4,ENBD,"We are extremely sorry for the inconvenience caused to you, and we have already replied to you via direct message.",Bank,Neutral,2026-03-22 20:31:00+04:00,22-03-2026
2035752651795861698,https://x.com/koko_isa8/status/2035752651795861698,https://x.com/koko_isa8,koko_isa8,κoκo мadeмöıseιιe⁸ 💅🏽,https://pbs.twimg.com/profile_images/2035262775103242240/J6m7iJmF_bigger.jpg,,@EmiratesNBD_AE @AppleSupport i have been struggling with my apple wallet for 4 months now. Since i changed from iphone14 to 17. I cannot add my cards (contact issuer) i have spoken to both of you & the problem has not been resolved yet. All steps were done from both sides too!,"<a href=""/EmiratesNBD_AE"" title=""Emirates NBD"">@EmiratesNBD_AE</a> <a href=""/AppleSupport"" title=""Apple Support"">@AppleSupport</a> i have been struggling with my apple wallet for 4 months now. Since i changed from iphone14 to 17. I cannot add my cards (contact issuer) i have spoken to both of you &amp; the problem has not been resolved yet. All steps were done from both sides too!",False,,,4h,"Mar 22, 2026 · 4:17 PM UTC",2026-03-22 16:17:00+00:00,,"['https://x.com/EmiratesNBD_AE', 'https://x.com/AppleSupport']",1,0,0,13,ENBD,"I have been struggling with my Apple Wallet for 4 months now. Since I changed from iPhone 14 to 17, I cannot add my cards (contact issuer). I have spoken to both of you, and the problem has not been resolved yet. All steps were done from both sides too!",Cust,Neutral,2026-03-22 20:17:00+04:00,22-03-2026
2035741438630117821,https://x.com/HashemTakriti/status/2035741438630117821,https://x.com/HashemTakriti,HashemTakriti,Hashem Takriti,https://pbs.twimg.com/profile_images/1081667250761990144/23AHZt15_bigger.jpg,,"Thanks, I’ve sent already and waiting for the response.","Thanks, I’ve sent already and waiting for the response.",False,,['EmiratesNBD_AE'],5h,"Mar 22, 2026 · 3:32 PM UTC",2026-03-22 15:32:00+00:00,,,0,0,0,4,ENBD,"Thank you, I have already sent it and am waiting for a response.",Cust,Neutral,2026-03-22 19:32:00+04:00,22-03-2026
2035724584830591430,https://x.com/AbhishekSu38296/status/2035724584830591430,https://x.com/AbhishekSu38296,AbhishekSu38296,Stock market information,https://pbs.twimg.com/profile_images/2029994100305580035/frXXlTOf_bigger.jpg,,"The 60.72% IDBI Bank sale was scrapped in March 2026 after bids from Fairfax and Emirates NBD missed the ₹70,000–72,000 crore reserve. This triggered a 15% share crash, leaving the government and LIC with a 94.72% stake. A smaller 10–15% OFS is now being considered.
#IDBI","The 60.72% IDBI Bank sale was scrapped in March 2026 after bids from Fairfax and Emirates NBD missed the ₹70,000–72,000 crore reserve. This triggered a 15% share crash, leaving the government and LIC with a 94.72% stake. A smaller 10–15% OFS is now being considered.
<a href=""/search?f=tweets&amp;q=%23IDBI"">#IDBI</a>",False,,,6h,"Mar 22, 2026 · 2:25 PM UTC",2026-03-22 14:25:00+00:00,,['https://x.com/search?f=tweets&q=%23IDBI'],0,0,0,62,ENBD,"The 60.72% sale of IDBI Bank was canceled in March 2026 after bids from Fairfax and Emirates NBD fell short of the ₹70,000–72,000 crore reserve. This caused a 15% drop in shares, leaving the government and LIC with a 94.72% stake. A smaller 10–15% Offer for Sale (OFS) is now being considered.",Cust,Neutral,2026-03-22 18:25:00+04:00,22-03-2026
2035718138407374875,https://x.com/EmiratesNBD_EGY/status/2035718138407374875,https://x.com/EmiratesNBD_EGY,EmiratesNBD_EGY,Emirates NBD,https://pbs.twimg.com/profile_images/1762427526482108416/qjFPlJ1n_bigger.jpg,,"Sports, teamwork, and Ramadan spirit came alive at Emirates NBD Ramadan Tournament 2026 !
68 teams and 100 players competed across multiple sports in an amazing display of energy and friendly competition.

Thank you to all participants and congrats to the winners!

Tax Registration Number: 204-897-319","Sports, teamwork, and Ramadan spirit came alive at Emirates NBD Ramadan Tournament 2026 !
68 teams and 100 players competed across multiple sports in an amazing display of energy and friendly competition.

Thank you to all participants and congrats to the winners!

Tax Registration Number: 204-897-319",False,,,6h,"Mar 22, 2026 · 2:00 PM UTC",2026-03-22 14:00:00+00:00,,,0,0,0,19,ENBD,"Sports, teamwork, and the spirit of Ramadan came alive at the Emirates NBD Ramadan Tournament 2026! 68 teams and 100 players competed across multiple sports in an amazing display of energy and friendly competition. Thank you to all participants and congratulations to the winners!",Bank,Neutral,2026-03-22 18:00:00+04:00,22-03-2026
2035716601996317089,https://x.com/getferel/status/2035716601996317089,https://x.com/getferel,getferel,Ferel,https://pbs.twimg.com/profile_images/2033220007656873984/jNeAtQ4g_bigger.jpg,,"IDBI Bank divestment story continues... 📋

After the strategic sale fell through (bids from Emirates NBD and Fairfax India fell short of reserve price), the government is now exploring OFS route.

Current setup:
• Govt: 45.48%
• LIC: 49.24%
• Public float: Just 5.29% 👀

Low float = poor price discovery. Expanding it to 15-20% could be a game-changer for valuation.

Worth watching when it happens. #GetFreel","IDBI Bank divestment story continues... 📋

After the strategic sale fell through (bids from Emirates NBD and Fairfax India fell short of reserve price), the government is now exploring OFS route.

Current setup:
• Govt: 45.48%
• LIC: 49.24%
• Public float: Just 5.29% 👀

Low float = poor price discovery. Expanding it to 15-20% could be a game-changer for valuation.

Worth watching when it happens. <a href=""/search?f=tweets&amp;q=%23GetFreel"">#GetFreel</a>",False,,,7h,"Mar 22, 2026 · 1:53 PM UTC",2026-03-22 13:53:00+00:00,,['https://x.com/search?f=tweets&q=%23GetFreel'],0,0,0,49,ENBD,"The IDBI Bank divestment story continues... 📋

After the strategic sale fell through (bids from Emirates NBD and Fairfax India fell short of the reserve price), the government is now exploring the OFS route.

Current setup:
• Government: 45.48%
• LIC: 49.24%
• Public float: Just 5.29% 👀

Low float = poor price discovery. Expanding it to 15-20% could be a game-changer for valuation.

Worth watching when it happens. #GetFreel",Cust,Neutral,2026-03-22 17:53:00+04:00,22-03-2026
2035716232872399173,https://x.com/Sosomostafa729S/status/2035716232872399173,https://x.com/Sosomostafa729S,Sosomostafa729S,Soha.mostafa77,https://pbs.twimg.com/profile_images/2034153587794972677/yhnd0_Le_bigger.jpg,,Exchanger volunteer program @Salma2232019 @semeet @SelmaRomola,"Exchanger volunteer program <a href=""/Salma2232019"" title=""Salma"">@Salma2232019</a> <a href=""/semeet"" title=""seema shelat"">@semeet</a> <a href=""/SelmaRomola"" title=""Selma Romola"">@SelmaRomola</a>",False,,['EmiratesNBD_AE'],7h,"Mar 22, 2026 · 1:52 PM UTC",2026-03-22 13:52:00+00:00,,"['https://x.com/Salma2232019', 'https://x.com/semeet', 'https://x.com/SelmaRomola']",0,0,0,2,ENBD,Exchanger volunteer program,Cust,Neutral,2026-03-22 17:52:00+04:00,22-03-2026
2035716104497369325,https://x.com/Sosomostafa729S/status/2035716104497369325,https://x.com/Sosomostafa729S,Sosomostafa729S,Soha.mostafa77,https://pbs.twimg.com/profile_images/2034153587794972677/yhnd0_Le_bigger.jpg,,Exchanger volunteer program @Emy191990 @ibushra_03 @parulghalout,"Exchanger volunteer program <a href=""/Emy191990"" title=""Eman Mohamed"">@Emy191990</a> <a href=""/ibushra_03"" title=""Bushra Muhammad 🇦🇪"">@ibushra_03</a> <a href=""/parulghalout"" title=""parul ghalout"">@parulghalout</a>",False,,['EmiratesNBD_AE'],7h,"Mar 22, 2026 · 1:51 PM UTC",2026-03-22 13:51:00+00:00,,"['https://x.com/Emy191990', 'https://x.com/ibushra_03', 'https://x.com/parulghalout']",0,0,0,2,ENBD,Exchanger volunteer program,Cust,Neutral,2026-03-22 17:51:00+04:00,22-03-2026
2035715949375152148,https://x.com/Sosomostafa729S/status/2035715949375152148,https://x.com/Sosomostafa729S,Sosomostafa729S,Soha.mostafa77,https://pbs.twimg.com/profile_images/2034153587794972677/yhnd0_Le_bigger.jpg,,FINEELL ( Financial Well-being program) with Emirates NBD @SelmaRomola @semeet @parulghalout,"FINEELL ( Financial Well-being program) with Emirates NBD <a href=""/SelmaRomola"" title=""Selma Romola"">@SelmaRomola</a> <a href=""/semeet"" title=""seema shelat"">@semeet</a> <a href=""/parulghalout"" title=""parul ghalout"">@parulghalout</a>",False,,['EmiratesNBD_AE'],7h,"Mar 22, 2026 · 1:51 PM UTC",2026-03-22 13:51:00+00:00,,"['https://x.com/SelmaRomola', 'https://x.com/semeet', 'https://x.com/parulghalout']",0,0,0,6,ENBD,FINEELL (Financial Well-being program) with Emirates NBD,Cust,Neutral,2026-03-22 17:51:00+04:00,22-03-2026
2035715849328435711,https://x.com/Sosomostafa729S/status/2035715849328435711,https://x.com/Sosomostafa729S,Sosomostafa729S,Soha.mostafa77,https://pbs.twimg.com/profile_images/2034153587794972677/yhnd0_Le_bigger.jpg,,"FINEELL ( Financial Well-being program) with Emirates NBD 
@Emy191990 @zeynp_qas @Salma2232019","FINEELL ( Financial Well-being program) with Emirates NBD 
<a href=""/Emy191990"" title=""Eman Mohamed"">@Emy191990</a> <a href=""/zeynp_qas"" title=""zeynab kasem"">@zeynp_qas</a> <a href=""/Salma2232019"" title=""Salma"">@Salma2232019</a>",False,,['EmiratesNBD_AE'],7h,"Mar 22, 2026 · 1:50 PM UTC",2026-03-22 13:50:00+00:00,,"['https://x.com/Emy191990', 'https://x.com/zeynp_qas', 'https://x.com/Salma2232019']",0,0,0,5,ENBD,FINEELL (Financial Well-being program) with Emirates NBD,Cust,Neutral,2026-03-22 17:50:00+04:00,22-03-2026
2035715583749357698,https://x.com/Sosomostafa729S/status/2035715583749357698,https://x.com/Sosomostafa729S,Sosomostafa729S,Soha.mostafa77,https://pbs.twimg.com/profile_images/2034153587794972677/yhnd0_Le_bigger.jpg,,Via the ENBD X Mobile App. @parulghalout @SelmaRomola @semeet,"Via the ENBD X Mobile App. <a href=""/parulghalout"" title=""parul ghalout"">@parulghalout</a> <a href=""/SelmaRomola"" title=""Selma Romola"">@SelmaRomola</a> <a href=""/semeet"" title=""seema shelat"">@semeet</a>",False,,['EmiratesNBD_AE'],7h,"Mar 22, 2026 · 1:49 PM UTC",2026-03-22 13:49:00+00:00,,"['https://x.com/parulghalout', 'https://x.com/SelmaRomola', 'https://x.com/semeet']",0,0,0,4,ENBD,Through the ENBD X Mobile App.,Cust,Neutral,2026-03-22 17:49:00+04:00,22-03-2026
2035715466585665903,https://x.com/Sosomostafa729S/status/2035715466585665903,https://x.com/Sosomostafa729S,Sosomostafa729S,Soha.mostafa77,https://pbs.twimg.com/profile_images/2034153587794972677/yhnd0_Le_bigger.jpg,,Via the ENBD X Mobile App. @Emy191990 @zeynp_qas @Salma2232019,"Via the ENBD X Mobile App. <a href=""/Emy191990"" title=""Eman Mohamed"">@Emy191990</a> <a href=""/zeynp_qas"" title=""zeynab kasem"">@zeynp_qas</a> <a href=""/Salma2232019"" title=""Salma"">@Salma2232019</a>",False,,['EmiratesNBD_AE'],7h,"Mar 22, 2026 · 1:49 PM UTC",2026-03-22 13:49:00+00:00,,"['https://x.com/Emy191990', 'https://x.com/zeynp_qas', 'https://x.com/Salma2232019']",0,0,0,5,ENBD,Through the ENBD X Mobile App.,Cust,Neutral,2026-03-22 17:49:00+04:00,22-03-2026
2035656314034995295,https://x.com/EmiratesNBD_AE/status/2035656314034995295,https://x.com/EmiratesNBD_AE,EmiratesNBD_AE,Emirates NBD,https://pbs.twimg.com/profile_images/1762427651271110656/jOUBidn8_bigger.jpg,,"We are so sorry to hear you had an unpleasant experience, please share with us your concern from your registered email address for further communication to social@emiratesnbd.com and tag the case reference number #987132 in the subject line.","We are so sorry to hear you had an unpleasant experience, please share with us your concern from your registered email address for further communication to social@emiratesnbd.com and tag the case reference number #987132 in the subject line.",False,,['ZahidanMuhamma'],11h,"Mar 22, 2026 · 9:54 AM UTC",2026-03-22 09:54:00+00:00,,,0,0,0,8,ENBD,We are very sorry to hear that you had an unpleasant experience. Please share your concerns with us from your registered email address for further communication at social@emiratesnbd.com and include the case reference number #987132 in the subject line.,Bank,Neutral,2026-03-22 13:54:00+04:00,22-03-2026
2035627541105348902,https://x.com/EmiratesNBD_AE/status/2035627541105348902,https://x.com/EmiratesNBD_AE,EmiratesNBD_AE,Emirates NBD,https://pbs.twimg.com/profile_images/1762427651271110656/jOUBidn8_bigger.jpg,,"Don’t click unfamiliar links.
Especially in SMS, WhatsApp, or DMs. When in doubt, don’t tap.

Stay safe. Stay vigilant. #UnitedAgainstFraud

emiratesnbd.com/en/campaigns…","Don’t click unfamiliar links.
Especially in SMS, WhatsApp, or DMs. When in doubt, don’t tap.

Stay safe. Stay vigilant. <a href=""/search?f=tweets&amp;q=%23UnitedAgainstFraud"">#UnitedAgainstFraud</a>

<a href=""https://www.emiratesnbd.com/en/campaigns/united-against-fraud"">emiratesnbd.com/en/campaigns…</a>",False,,,12h,"Mar 22, 2026 · 8:00 AM UTC",2026-03-22 08:00:00+00:00,,"['https://x.com/search?f=tweets&q=%23UnitedAgainstFraud', 'https://www.emiratesnbd.com/en/campaigns/united-against-fraud']",0,0,5,714,ENBD,"Don't click unfamiliar links. Especially in SMS, WhatsApp, or DMs. When in doubt, don't tap. Stay safe. Stay vigilant. #UnitedAgainstFraud",Bank,Neutral,2026-03-22 12:00:00+04:00,22-03-2026
2035612442487661044,https://x.com/EmiratesNBD_AE/status/2035612442487661044,https://x.com/EmiratesNBD_AE,EmiratesNBD_AE,Emirates NBD,https://pbs.twimg.com/profile_images/1762427651271110656/jOUBidn8_bigger.jpg,,"Spot the red flags before it’s too late. Fake jobs ask for fees, transfers or banking information. Always verify, stay alert and protect yourself. #UnitedAgainstFraud","Spot the red flags before it’s too late. Fake jobs ask for fees, transfers or banking information. Always verify, stay alert and protect yourself. <a href=""/search?f=tweets&amp;q=%23UnitedAgainstFraud"">#UnitedAgainstFraud</a>",False,,,13h,"Mar 22, 2026 · 7:00 AM UTC",2026-03-22 07:00:00+00:00,,['https://x.com/search?f=tweets&q=%23UnitedAgainstFraud'],0,0,3,570,ENBD,"Spot the red flags before it’s too late. Fake jobs ask for fees, transfers, or banking information. Always verify, stay alert, and protect yourself. #UnitedAgainstFraud",Bank,Neutral,2026-03-22 11:00:00+04:00,22-03-2026
2035599627253342599,https://x.com/ZahidanMuhamma/status/2035599627253342599,https://x.com/ZahidanMuhamma,ZahidanMuhamma,Muhammad Zahidan,https://pbs.twimg.com/profile_images/1827047486680137728/R86Fb-lT_bigger.jpg,,this bank is crappy I have withdrawal for 300 USD at 5 March but still not receiving my funds and still going on internal validation,this bank is crappy I have withdrawal for 300 USD at 5 March but still not receiving my funds and still going on internal validation,False,,['EmiratesNBD_AE'],14h,"Mar 22, 2026 · 6:09 AM UTC",2026-03-22 06:09:00+00:00,,,1,0,0,7,ENBD,"This bank is terrible. I made a withdrawal of 300 USD on March 5, but I still haven't received my funds, and it's still undergoing internal validation.",Cust,Negative,2026-03-22 10:09:00+04:00,22-03-2026
2035431246830940246,https://x.com/EmiratesNBD_EGY/status/2035431246830940246,https://x.com/EmiratesNBD_EGY,EmiratesNBD_EGY,Emirates NBD,https://pbs.twimg.com/profile_images/1762427526482108416/qjFPlJ1n_bigger.jpg,,"Shop Mother’s Day gifts. Pay your way.
Discover all your favorite brands in one place in Jlood with 0% down payment, 0%interset, 0% processing fees on 6 months through the website when you pay using Emirates NBD credit cards.
 
Offer is valid till 15 April 2026.

Terms and conditions apply.
Tax registration number: 204-897-319","Shop Mother’s Day gifts. Pay your way.
Discover all your favorite brands in one place in Jlood with 0% down payment, 0%interset, 0% processing fees on 6 months through the website when you pay using Emirates NBD credit cards.
 
Offer is valid till 15 April 2026.

Terms and conditions apply.
Tax registration number: 204-897-319",False,,,Mar 21,"Mar 21, 2026 · 7:00 PM UTC",2026-03-21 19:00:00+00:00,,,0,0,0,41,ENBD,"Shop Mother’s Day gifts. Pay your way. Discover all your favorite brands in one place in Jlood with 0% down payment, 0% interest, 0% processing fees for 6 months through the website when you pay using Emirates NBD credit cards. Offer is valid until April 15, 2026. Terms and conditions apply. Tax registration number: 204-897-319",Bank,Neutral,2026-03-21 23:00:00+04:00,21-03-2026
2035319817167642659,https://x.com/EmiratesNBD_AE/status/2035319817167642659,https://x.com/EmiratesNBD_AE,EmiratesNBD_AE,Emirates NBD,https://pbs.twimg.com/profile_images/1762427651271110656/jOUBidn8_bigger.jpg,,We will make every effort to address the matter promptly and provide the necessary support. Thanks,We will make every effort to address the matter promptly and provide the necessary support. Thanks,False,,['HashemTakriti'],Mar 21,"Mar 21, 2026 · 11:37 AM UTC",2026-03-21 11:37:00+00:00,,,0,0,0,27,ENBD,We will make every effort to address the matter promptly and provide the necessary support. Thanks,Bank,Neutral,2026-03-21 15:37:00+04:00,21-03-2026
2035319718182064320,https://x.com/EmiratesNBD_AE/status/2035319718182064320,https://x.com/EmiratesNBD_AE,EmiratesNBD_AE,Emirates NBD,https://pbs.twimg.com/profile_images/1762427651271110656/jOUBidn8_bigger.jpg,,"We sincerely regret for the inconvenience To be able to assist further, we kindly request you to reach 

social@emiratesnbd.com

Quoting case #986959 in the subject line of the email from your registered email address","We sincerely regret for the inconvenience To be able to assist further, we kindly request you to reach 

social@emiratesnbd.com

Quoting case #986959 in the subject line of the email from your registered email address",False,,['HashemTakriti'],Mar 21,"Mar 21, 2026 · 11:36 AM UTC",2026-03-21 11:36:00+00:00,,,1,0,0,26,ENBD,"We sincerely regret the inconvenience. To assist you further, we kindly request that you reach out to social@emiratesnbd.com, quoting case #986959 in the subject line of the email from your registered email address.",Bank,Neutral,2026-03-21 15:36:00+04:00,21-03-2026
2035315857136451998,https://x.com/HashemTakriti/status/2035315857136451998,https://x.com/HashemTakriti,HashemTakriti,Hashem Takriti,https://pbs.twimg.com/profile_images/1081667250761990144/23AHZt15_bigger.jpg,,"@EmiratesNBD_AE Frustrated with @EmiratesNBD_AE 😡
I’ve been facing a “trusted device” issue on the app for 3 months, blocking all my online transactions.

After a lot of calls, multiple complaints & requests — still no resolution.

This is unacceptable for a bank of this scale. Urgently need support to fix this ASAP.","<a href=""/EmiratesNBD_AE"" title=""Emirates NBD"">@EmiratesNBD_AE</a> Frustrated with <a href=""/EmiratesNBD_AE"" title=""Emirates NBD"">@EmiratesNBD_AE</a> 😡
I’ve been facing a “trusted device” issue on the app for 3 months, blocking all my online transactions.

After a lot of calls, multiple complaints &amp; requests — still no resolution.

This is unacceptable for a bank of this scale. Urgently need support to fix this ASAP.",False,,,Mar 21,"Mar 21, 2026 · 11:21 AM UTC",2026-03-21 11:21:00+00:00,,"['https://x.com/EmiratesNBD_AE', 'https://x.com/EmiratesNBD_AE']",2,0,0,33,ENBD,"Frustrated with Emirates NBD. I’ve been facing a “trusted device” issue on the app for 3 months, blocking all my online transactions. After a lot of calls, multiple complaints and requests — still no resolution. This is unacceptable for a bank of this scale. I urgently need support to fix this as soon as possible.",Cust,Negative,2026-03-21 15:21:00+04:00,21-03-2026
2035310451945255256,https://x.com/EmiratesNBD_EGY/status/2035310451945255256,https://x.com/EmiratesNBD_EGY,EmiratesNBD_EGY,Emirates NBD,https://pbs.twimg.com/profile_images/1762427526482108416/qjFPlJ1n_bigger.jpg,,"This Mother’s Day, Emirates NBD staff took time to celebrate the voices that matter most.
Our team connected with their moms through heartfelt conversations filled with love and gratitude.

Tax Registration Number: 204-897-319","This Mother’s Day, Emirates NBD staff took time to celebrate the voices that matter most.
Our team connected with their moms through heartfelt conversations filled with love and gratitude.

Tax Registration Number: 204-897-319",False,,,Mar 21,"Mar 21, 2026 · 11:00 AM UTC",2026-03-21 11:00:00+00:00,,,0,0,0,35,ENBD,"This Mother’s Day, Emirates NBD staff took time to celebrate the voices that matter most. Our team connected with their moms through heartfelt conversations filled with love and gratitude.",Bank,Positive,2026-03-21 15:00:00+04:00,21-03-2026
2035265155689251255,https://x.com/EmiratesNBD_AE/status/2035265155689251255,https://x.com/EmiratesNBD_AE,EmiratesNBD_AE,Emirates NBD,https://pbs.twimg.com/profile_images/1762427651271110656/jOUBidn8_bigger.jpg,,"What would you do if a delivery agent asks for a ‘small online fee’?

Stay safe. Stay vigilant. #UnitedAgainstFraud

emiratesnbd.com/en/campaigns…","What would you do if a delivery agent asks for a ‘small online fee’?

Stay safe. Stay vigilant. <a href=""/search?f=tweets&amp;q=%23UnitedAgainstFraud"">#UnitedAgainstFraud</a>

<a href=""https://www.emiratesnbd.com/en/campaigns/united-against-fraud"">emiratesnbd.com/en/campaigns…</a>",False,,,Mar 21,"Mar 21, 2026 · 8:00 AM UTC",2026-03-21 08:00:00+00:00,,"['https://x.com/search?f=tweets&q=%23UnitedAgainstFraud', 'https://www.emiratesnbd.com/en/campaigns/united-against-fraud']",1,1,1,581,ENBD,"What would you do if a delivery agent asks for a 'small online fee'? 

Stay safe. Stay vigilant. #UnitedAgainstFraud",Bank,Neutral,2026-03-21 12:00:00+04:00,21-03-2026
2035250053074284602,https://x.com/EmiratesNBD_AE/status/2035250053074284602,https://x.com/EmiratesNBD_AE,EmiratesNBD_AE,Emirates NBD,https://pbs.twimg.com/profile_images/1762427651271110656/jOUBidn8_bigger.jpg,,"To limit online scam risks, just lower your card limits! With ENBD X App, you’re in control – reduce card limits anytime, anywhere! Stay one step ahead of fraud. Stay #UnitedAgainstFraud","To limit online scam risks, just lower your card limits! With ENBD X App, you’re in control – reduce card limits anytime, anywhere! Stay one step ahead of fraud. Stay <a href=""/search?f=tweets&amp;q=%23UnitedAgainstFraud"">#UnitedAgainstFraud</a>",False,,,Mar 21,"Mar 21, 2026 · 7:00 AM UTC",2026-03-21 07:00:00+00:00,,['https://x.com/search?f=tweets&q=%23UnitedAgainstFraud'],0,2,14,1126,ENBD,"To limit online scam risks, just lower your card limits! With the ENBD X App, you’re in control – reduce card limits anytime, anywhere! Stay one step ahead of fraud. Stay #UnitedAgainstFraud",Bank,Positive,2026-03-21 11:00:00+04:00,21-03-2026
2035229783324598672,https://x.com/Salamah_2022/status/2035229783324598672,https://x.com/Salamah_2022,Salamah_2022,salamah,https://pbs.twimg.com/profile_images/1619540358542622721/g_HWEYG2_bigger.jpg,,"To buy gold and silver through Emirates NBD, the fastest way is using the ENBD X mobile app. 
@basmatamal8888 
@tariqalsheikh76 
 @Rossa5566","To buy gold and silver through Emirates NBD, the fastest way is using the ENBD X mobile app. 
<a href=""/basmatamal8888"" title=""بسمةأمل"">@basmatamal8888</a> 
<a href=""/tariqalsheikh76"" title=""Tariq Alsheikh"">@tariqalsheikh76</a> 
 <a href=""/Rossa5566"" title=""zahra"">@Rossa5566</a>",False,,['EmiratesNBD_AE'],Mar 21,"Mar 21, 2026 · 5:39 AM UTC",2026-03-21 05:39:00+00:00,,"['https://x.com/basmatamal8888', 'https://x.com/tariqalsheikh76', 'https://x.com/Rossa5566']",0,0,0,12,ENBD,"To buy gold and silver through Emirates NBD, the fastest way is using the ENBD X mobile app.",Cust,Neutral,2026-03-21 09:39:00+04:00,21-03-2026
2035115147119723004,https://x.com/Kanakanui3000/status/2035115147119723004,https://x.com/Kanakanui3000,Kanakanui3000,Digitalwellness101,https://pbs.twimg.com/profile_images/1710069648715091968/Nqh0ZCLH_bigger.jpg,,"Eid Mubarak 🌙 Wishing you calm days, strong vibes, and quality time with loved ones. Treat yourself to rest and movement — you earned it. #Eid #SelfCare #Digitalwellness101","Eid Mubarak 🌙 Wishing you calm days, strong vibes, and quality time with loved ones. Treat yourself to rest and movement — you earned it. <a href=""/search?f=tweets&amp;q=%23Eid"">#Eid</a> <a href=""/search?f=tweets&amp;q=%23SelfCare"">#SelfCare</a> <a href=""/search?f=tweets&amp;q=%23Digitalwellness101"">#Digitalwellness101</a>",False,,,Mar 20,"Mar 20, 2026 · 10:03 PM UTC",2026-03-20 22:03:00+00:00,,"['https://x.com/search?f=tweets&q=%23Eid', 'https://x.com/search?f=tweets&q=%23SelfCare', 'https://x.com/search?f=tweets&q=%23Digitalwellness101']",0,0,0,7,ENBD,"Eid Mubarak 🌙 Wishing you calm days, strong vibes, and quality time with loved ones. Treat yourself to rest and movement — you earned it. #Eid #SelfCare #Digitalwellness101",Cust,Neutral,2026-03-21 02:03:00+04:00,21-03-2026
